{
  "$schema": "data-structures/schema/board.schema.json",
  "schemaVersion": 1,
  "kind": "board",
  "source_files": [
    "components/runit/runit_board_defs.h",
    "components/runit/runit_board_cfg.c"
  ],
  "i2c_buses": {
    "internal": 0,
    "user": 1
  },
  "devices": [
    {
      "id": 0,
      "symbol": "DEVICE_ID_GPIO_ESP",
      "name": "GPIO_ESP",
      "driver": "gpio_esp",
      "descriptor": "device_gpio_esp",
      "title": "ESP32 native GPIO",
      "installed": true
    },
    {
      "id": 1,
      "symbol": "DEVICE_ID_TCA6424A",
      "name": "TCA6424A",
      "driver": "tca6424a",
      "descriptor": "device_tca6424a",
      "title": "TCA6424A GPIO expander",
      "installed": true,
      "i2c": {
        "bus": 0,
        "address": 35
      },
      "pins": [
        {
          "use": "intr_pin",
          "device": 0,
          "pin": 9,
          "mode": "SYS_IO_MODE_INPUT"
        },
        {
          "use": "rst_pin",
          "device": 0,
          "pin": 8,
          "mode": "SYS_IO_MODE_OUTPUT_PUSH_PULL"
        }
      ]
    },
    {
      "id": 2,
      "symbol": "DEVICE_ID_ADS7128",
      "name": "ADS7128",
      "driver": "ads7128",
      "descriptor": "device_ads_7128",
      "title": "ADS7128 ADC",
      "installed": true,
      "i2c": {
        "bus": 0,
        "address": 16
      },
      "pins": [
        {
          "use": "intr_pin",
          "device": 0,
          "pin": 42,
          "mode": "SYS_IO_MODE_INPUT_PULLUP"
        }
      ]
    },
    {
      "id": 3,
      "symbol": "DEVICE_ID_PCA9685",
      "name": "PCA9685",
      "driver": "pca9685",
      "descriptor": "device_pca9685",
      "title": "PCA9685 PWM expander",
      "installed": true,
      "i2c": {
        "bus": 0,
        "address": 96
      },
      "pins": [
        {
          "use": "oe_pin",
          "device": 1,
          "pin": 0,
          "mode": "SYS_IO_MODE_OUTPUT_PUSH_PULL"
        }
      ]
    },
    {
      "id": 4,
      "symbol": "DEVICE_ID_DAC53202",
      "name": "DAC53202",
      "driver": "dac53202",
      "descriptor": "device_dac53202",
      "title": "DAC53202 dual DAC",
      "installed": true,
      "i2c": {
        "bus": 0,
        "address": 72
      }
    },
    {
      "id": 5,
      "symbol": "DEVICE_ID_DRV8962_0",
      "name": "DRV8962_0",
      "driver": "drv8962",
      "descriptor": "device_drv8962",
      "title": "DRV8962 motor driver",
      "installed": false,
      "pins": [
        {
          "use": "in1_pin",
          "device": 0,
          "pin": 21,
          "mode": "SYS_IO_MODE_PWM"
        },
        {
          "use": "in2_pin",
          "device": 0,
          "pin": 47,
          "mode": "SYS_IO_MODE_PWM"
        },
        {
          "use": "in3_pin",
          "device": 0,
          "pin": 48,
          "mode": "SYS_IO_MODE_PWM"
        },
        {
          "use": "in4_pin",
          "device": 0,
          "pin": 45,
          "mode": "SYS_IO_MODE_PWM"
        },
        {
          "use": "en1_pin",
          "device": 0,
          "pin": 38,
          "mode": "SYS_IO_MODE_OUTPUT_PUSH_PULL"
        },
        {
          "use": "en2_pin",
          "device": 0,
          "pin": 39,
          "mode": "SYS_IO_MODE_OUTPUT_PUSH_PULL"
        },
        {
          "use": "en3_pin",
          "device": 0,
          "pin": 2,
          "mode": "SYS_IO_MODE_OUTPUT_PUSH_PULL"
        },
        {
          "use": "en4_pin",
          "device": 0,
          "pin": 1,
          "mode": "SYS_IO_MODE_OUTPUT_PUSH_PULL"
        },
        {
          "use": "ipropi1_pin",
          "device": 0,
          "pin": 7,
          "mode": "SYS_IO_MODE_ADC"
        },
        {
          "use": "ipropi2_pin",
          "device": 0,
          "pin": 6,
          "mode": "SYS_IO_MODE_ADC"
        },
        {
          "use": "ipropi3_pin",
          "device": 0,
          "pin": 5,
          "mode": "SYS_IO_MODE_ADC"
        },
        {
          "use": "ipropi4_pin",
          "device": 0,
          "pin": 4,
          "mode": "SYS_IO_MODE_ADC"
        },
        {
          "use": "nsleep_pin",
          "device": 1,
          "pin": 9,
          "mode": "SYS_IO_MODE_OUTPUT_PUSH_PULL"
        },
        {
          "use": "nfault_pin",
          "device": 1,
          "pin": 11,
          "mode": "SYS_IO_MODE_INPUT"
        },
        {
          "use": "vref_pin",
          "device": 4,
          "pin": 0,
          "mode": "SYS_IO_MODE_DAC"
        }
      ]
    },
    {
      "id": 6,
      "symbol": "DEVICE_ID_DRV8962_1",
      "name": "DRV8962_1",
      "driver": "drv8962",
      "descriptor": "device_drv8962",
      "title": "DRV8962 motor driver",
      "installed": true,
      "pins": [
        {
          "use": "in1_pin",
          "device": 3,
          "pin": 8,
          "mode": "SYS_IO_MODE_PWM"
        },
        {
          "use": "in2_pin",
          "device": 3,
          "pin": 9,
          "mode": "SYS_IO_MODE_PWM"
        },
        {
          "use": "in3_pin",
          "device": 3,
          "pin": 10,
          "mode": "SYS_IO_MODE_PWM"
        },
        {
          "use": "in4_pin",
          "device": 3,
          "pin": 11,
          "mode": "SYS_IO_MODE_PWM"
        },
        {
          "use": "en1_pin",
          "device": 3,
          "pin": 12,
          "mode": "SYS_IO_MODE_OUTPUT_PUSH_PULL"
        },
        {
          "use": "en2_pin",
          "device": 3,
          "pin": 13,
          "mode": "SYS_IO_MODE_OUTPUT_PUSH_PULL"
        },
        {
          "use": "en3_pin",
          "device": 3,
          "pin": 14,
          "mode": "SYS_IO_MODE_OUTPUT_PUSH_PULL"
        },
        {
          "use": "en4_pin",
          "device": 3,
          "pin": 15,
          "mode": "SYS_IO_MODE_OUTPUT_PUSH_PULL"
        },
        {
          "use": "nsleep_pin",
          "device": 1,
          "pin": 8,
          "mode": "SYS_IO_MODE_OUTPUT_PUSH_PULL"
        },
        {
          "use": "nfault_pin",
          "device": 1,
          "pin": 10,
          "mode": "SYS_IO_MODE_INPUT"
        },
        {
          "use": "vref_pin",
          "device": 4,
          "pin": 1,
          "mode": "SYS_IO_MODE_DAC"
        }
      ]
    },
    {
      "id": 10,
      "symbol": "DEVICE_ID_TPS55289_2",
      "name": "TPS55289_2",
      "driver": "tps55289",
      "descriptor": "device_tps55289",
      "title": "TPS55289 buck-boost regulator",
      "installed": true,
      "i2c": {
        "bus": 0,
        "address": 116
      },
      "pins": [
        {
          "use": "intr_pin",
          "device": 1,
          "pin": 1,
          "mode": "SYS_IO_MODE_INPUT"
        },
        {
          "use": "en_pin",
          "device": 1,
          "pin": 17,
          "mode": "SYS_IO_MODE_OUTPUT_PUSH_PULL"
        }
      ]
    },
    {
      "id": 11,
      "symbol": "DEVICE_ID_TPS55289_1",
      "name": "TPS55289_1",
      "driver": "tps55289",
      "descriptor": "device_tps55289",
      "title": "TPS55289 buck-boost regulator",
      "installed": true,
      "i2c": {
        "bus": 0,
        "address": 117
      },
      "pins": [
        {
          "use": "intr_pin",
          "device": 1,
          "pin": 2,
          "mode": "SYS_IO_MODE_INPUT"
        },
        {
          "use": "en_pin",
          "device": 1,
          "pin": 16,
          "mode": "SYS_IO_MODE_OUTPUT_PUSH_PULL"
        }
      ]
    },
    {
      "id": 12,
      "symbol": "DEVICE_ID_INA3221",
      "name": "INA3221",
      "driver": "ina3221",
      "descriptor": "device_ina3221",
      "title": "INA3221 power monitor",
      "installed": true,
      "i2c": {
        "bus": 0,
        "address": 64
      },
      "pins": [
        {
          "use": "crit_pin",
          "device": 1,
          "pin": 6,
          "mode": "SYS_IO_MODE_INPUT"
        },
        {
          "use": "warn_pin",
          "device": 1,
          "pin": 5,
          "mode": "SYS_IO_MODE_INPUT"
        }
      ]
    },
    {
      "id": 13,
      "symbol": "DEVICE_ID_AP33772S",
      "name": "AP33772S",
      "driver": "ap33772s",
      "descriptor": "device_ap33772s",
      "title": "AP33772S USB-C PD sink",
      "installed": true,
      "i2c": {
        "bus": 0,
        "address": 82
      },
      "pins": [
        {
          "use": "intr_pin",
          "device": 1,
          "pin": 21,
          "mode": "SYS_IO_MODE_INPUT"
        }
      ]
    }
  ],
  "pin_setup": [
    {
      "device": 1,
      "pin": 22,
      "mode": "SYS_IO_MODE_OUTPUT_PUSH_PULL",
      "installed": true,
      "label": "Status LEDs (high = on). 22 stays on after boot (the chip's output latch resets to high), 23 is off"
    },
    {
      "device": 1,
      "pin": 23,
      "mode": "SYS_IO_MODE_OUTPUT_PUSH_PULL",
      "installed": true,
      "label": "Status LEDs (high = on). 22 stays on after boot (the chip's output latch resets to high), 23 is off",
      "level": false
    },
    {
      "device": 1,
      "pin": 12,
      "mode": "SYS_IO_MODE_OUTPUT_PUSH_PULL",
      "installed": true,
      "label": "LM73100: DRV8962 #2 VM <- rail A (TPS55289 0x74)",
      "level": false
    },
    {
      "device": 1,
      "pin": 13,
      "mode": "SYS_IO_MODE_OUTPUT_PUSH_PULL",
      "installed": true,
      "label": "LM73100: DRV8962 #2 VM <- board input",
      "level": false
    },
    {
      "device": 1,
      "pin": 14,
      "mode": "SYS_IO_MODE_OUTPUT_PUSH_PULL",
      "installed": true,
      "label": "LM73100: DRV8962 #1 VM <- board input",
      "level": false
    },
    {
      "device": 1,
      "pin": 15,
      "mode": "SYS_IO_MODE_OUTPUT_PUSH_PULL",
      "installed": true,
      "label": "LM73100: DRV8962 #1 VM <- rail B (TPS55289 0x75)",
      "level": false
    }
  ],
  "reserved_pins": [
    {
      "device": 0,
      "pin": 15,
      "label": "I2C 0 SDA (internal)"
    },
    {
      "device": 0,
      "pin": 16,
      "label": "I2C 0 SCL (internal)"
    },
    {